{
  "schemaVersion": 1,
  "id": "single-arm-dumbbell-chest-press",
  "slug": "single-arm-dumbbell-chest-press",
  "name": {
    "en": "Single-Arm Dumbbell Chest Press",
    "tr": "Tek Kol Dambıl Göğüs Pressi"
  },
  "description": {
    "en": "A unilateral dumbbell chest press performed on a flat bench while resisting torso rotation.",
    "tr": "Gövdenin dönmesine direnerek düz sehpada tek kolla yapılan dambıl göğüs pressi."
  },
  "category": "strength",
  "movementPattern": "push",
  "force": "push",
  "mechanic": "compound",
  "difficulty": "intermediate",
  "equipment": [
    "bench",
    "dumbbell"
  ],
  "primaryMuscles": [
    "chest"
  ],
  "secondaryMuscles": [
    "shoulders",
    "triceps",
    "abdominals"
  ],
  "instructions": {
    "en": [
      "Lie on a flat bench with feet planted; hold one dumbbell beside the chest and keep the free hand safely at your side.",
      "Press the dumbbell above the chest while keeping both shoulders and hips level.",
      "Lower under control and repeat; switch arms and use a load that lets you resist torso rotation."
    ],
    "tr": [
      "Ayakların yerde olacak şekilde düz sehpaya uzan; bir dambılı göğsünün yanında tut, boş elini güvenle yanında bırak.",
      "İki omzunu ve kalçanı aynı hizada tutarak dambılı göğsünün üzerine it.",
      "Kontrollü biçimde indirip tekrarla; sonra kol değiştir ve gövdenin dönmesine direnebildiğin bir yük seç."
    ]
  },
  "source": {
    "type": "original",
    "title": "Open Exercise Atlas editorial draft",
    "license": "CC0-1.0"
  },
  "reviewStatus": "pending",
  "alternatives": [
    "dumbbell-bench-press",
    "half-kneeling-single-arm-dumbbell-press"
  ],
  "media": [
    {
      "path": "media/exercises/single-arm-dumbbell-chest-press.webp",
      "role": "reference",
      "alt": {
        "en": "Two-phase grayscale illustration of Single-Arm Dumbbell Chest Press; chest muscles highlighted in red.",
        "tr": "Tek Kol Dambıl Göğüs Pressi hareketinin iki aşamalı gri tonlu çizimi; göğüs kasları kırmızıyla vurgulanmış."
      },
      "creator": "Open Exercise Atlas (AI-assisted original illustration)",
      "sourceUrl": "https://github.com/yagizerentunay/open-exercise-atlas/blob/main/media/exercises/single-arm-dumbbell-chest-press.webp",
      "license": "CC0-1.0",
      "redistributionEvidenceUrl": "https://github.com/yagizerentunay/open-exercise-atlas/blob/main/docs/pilots/muscle-expansion-2026-10-17-batch-15.md"
    }
  ]
}
