{
  "schemaVersion": 1,
  "id": "dumbbell-kickstand-romanian-deadlift",
  "slug": "dumbbell-kickstand-romanian-deadlift",
  "name": {
    "en": "Dumbbell Kickstand Romanian Deadlift",
    "tr": "Dambılla Destek Ayaklı Romanian Deadlift"
  },
  "description": {
    "en": "A staggered-stance hinge loading the front leg while the rear foot supports balance.",
    "tr": "Arka ayak denge sağlarken ön bacağı yükleyen kademeli duruşlu kalça menteşesi."
  },
  "category": "strength",
  "movementPattern": "hinge",
  "difficulty": "intermediate",
  "equipment": [
    "dumbbell"
  ],
  "primaryMuscles": [
    "hamstrings"
  ],
  "secondaryMuscles": [
    "glutes",
    "lower-back"
  ],
  "force": "pull",
  "mechanic": "compound",
  "instructions": {
    "en": [
      "Hold a dumbbell in each hand, stagger the feet and place most weight on the front foot.",
      "Soften the front knee and push hips back, lowering weights near the leg.",
      "Drive through the front foot and stand; keep the rear foot light."
    ],
    "tr": [
      "Her elinde dambıl tut; ayaklarını kademeli yerleştirip ağırlığını çoğunlukla öne ver.",
      "Ön dizini hafif bük, kalçanı geriye gönder ve ağırlıkları bacağa yakın indir.",
      "Ön ayaktan güç alıp doğrul; arka ayağı hafif destek olarak kullan."
    ]
  },
  "source": {
    "type": "original",
    "title": "Open Exercise Atlas editorial draft",
    "license": "CC0-1.0"
  },
  "reviewStatus": "pending",
  "media": [
    {
      "path": "media/exercises/dumbbell-kickstand-romanian-deadlift.webp",
      "role": "reference",
      "alt": {
        "en": "Two-panel grayscale illustration of Dumbbell Kickstand Romanian Deadlift with the target muscle highlighted in red.",
        "tr": "Dambılla Destek Ayaklı Romanian Deadlift hareketinin iki aşamalı gri tonlu çizimi; hedef kas kırmızıyla vurgulanmış."
      },
      "creator": "Open Exercise Atlas (AI-assisted original illustration)",
      "sourceUrl": "https://github.com/yagizerentunay/open-exercise-atlas/blob/main/media/exercises/dumbbell-kickstand-romanian-deadlift.webp",
      "license": "CC0-1.0",
      "redistributionEvidenceUrl": "https://github.com/yagizerentunay/open-exercise-atlas/blob/main/docs/pilots/muscle-expansion-2026-10-17.md"
    }
  ]
}