{
  "schemaVersion": 1,
  "id": "seated-machine-biceps-curl",
  "slug": "seated-machine-biceps-curl",
  "name": {
    "en": "Seated Machine Biceps Curl",
    "tr": "Makinede Oturarak Biceps Curl"
  },
  "description": {
    "en": "A seated elbow-flexion exercise performed with the upper arms supported on a machine pad.",
    "tr": "Üst kollar makine pedinde desteklenirken dirsekleri bükerek yapılan oturarak biceps curl hareketi."
  },
  "category": "strength",
  "movementPattern": "isolation",
  "force": "pull",
  "mechanic": "isolation",
  "difficulty": "beginner",
  "equipment": ["machine"],
  "primaryMuscles": ["biceps"],
  "secondaryMuscles": ["forearms"],
  "instructions": {
    "en": [
      "Adjust the seat so your elbows line up with the machine pivot; sit upright and place your upper arms on the angled pad.",
      "Keeping your wrists neutral and upper arms on the pad, curl the handles toward your chest without rocking your torso.",
      "Lower the handles slowly until your arms are nearly straight, without locking your elbows."
    ],
    "tr": [
      "Dirseklerin makinenin dönme ekseniyle hizalanacak şekilde koltuğu ayarla; dik oturup üst kollarını eğimli pede yerleştir.",
      "Bileklerini düz ve üst kollarını pedde tutarak gövdeni sallamadan kolları göğsüne doğru bük.",
      "Dirseklerini kilitlemeden kolların neredeyse düz olana kadar tutacakları yavaşça indir."
    ]
  },
  "source": {
    "type": "original",
    "title": "Open Exercise Atlas illustrated muscle coverage",
    "license": "CC0-1.0"
  },
  "reviewStatus": "pending",
  "media": [
    {
      "path": "media/exercises/seated-machine-biceps-curl.webp",
      "role": "reference",
      "alt": {
        "en": "Two grayscale panels show the lowered and curled positions of a seated machine biceps curl, with the biceps highlighted in red.",
        "tr": "Makinede Oturarak Biceps Curl hareketinin başlangıç ve curl pozisyonları iki gri karede gösteriliyor; biceps kasları kırmızıyla vurgulanmış."
      },
      "creator": "Open Exercise Atlas (AI-assisted original illustration)",
      "sourceUrl": "https://github.com/yagizerentunay/open-exercise-atlas/blob/main/media/exercises/seated-machine-biceps-curl.webp",
      "license": "CC0-1.0",
      "redistributionEvidenceUrl": "https://github.com/yagizerentunay/open-exercise-atlas/blob/main/docs/media-provenance.md"
    }
  ]
}
